{
  "workflow_id": "beedb39b-bf5b-5e09-8b6a-35d3c847c4ee",
  "tenant_id": "286ea0c9-1360-5574-84ae-b88f28527610",
  "reset_epoch": 1,
  "company_id": "286ea0c9-1360-5574-84ae-b88f28527610",
  "document_id": "83243ed0-3713-5631-bf48-279cc7a257ec",
  "trigger_event_id": "a2c5fb03-554a-5464-90fb-97af3a4dd3de",
  "correlation_id": "ff6f9950-5e7d-5aa1-b38a-f96a50d96125",
  "state": "awaiting_founder",
  "state_version": 8,
  "last_event_seq": 13,
  "intake_seq": 1,
  "active_run_id": null,
  "active_proposal_id": "ef28b9a9-1e7a-5f52-b65a-9b5253230a5b",
  "review_bundle_id": "f660de0e-5a11-5782-ba17-46d096f61d03",
  "document_slot_epoch": 3,
  "pinned_base_revision_id": "76a93b17-2e92-595e-a3c8-c287d24e14aa",
  "founder_approval_id": null,
  "lawyer_approval_id": null,
  "wait": {
    "kind": "founder",
    "since": "2026-09-26T17:00:00Z",
    "required_role": "founder",
    "reason_code": "validated_proposal_ready"
  },
  "last_error": null,
  "created_at": "2026-09-26T17:00:00Z",
  "updated_at": "2026-09-26T17:00:00Z"
}
